{
  "metaVersion": "1.0.0",
  "status": "beta",
  "name": "rr-table-row",
  "summary": "A row inside rr-table; carries role=row, its zebra/hover/selected visuals are painted by the parent table's stylesheet.",
  "package": "@digital2analogue2/parsimony-components",
  "props": [
    { "name": "selected", "type": "boolean", "default": false }
  ],
  "slots": [
    { "name": "(default)", "description": "rr-table-cell elements." }
  ],
  "events": [],
  "cssParts": [],
  "tokensUsed": [
    "--motion-duration-instant",
    "--motion-easing-default"
  ],
  "rules": [
    "Never use hex values. Always use var(--color-*) or var(--component-*)",
    "Never reference --primitive-* tokens in component code",
    "Drive selected from your selection model — it is the only state the row owns"
  ],
  "examples": [
    { "title": "Row", "html": "<rr-table-row>\n  <rr-table-cell>High-value approvals</rr-table-cell>\n</rr-table-row>" },
    { "title": "Selected row", "html": "<rr-table-row selected>\n  <rr-table-cell>Low income</rr-table-cell>\n</rr-table-row>" }
  ],
  "accessibility": {
    "ariaPattern": "https://www.w3.org/WAI/ARIA/apg/patterns/table/",
    "role": "row",
    "focusable": false,
    "keyboard": [
      "None of its own — interactive cell content keeps its native keyboard behavior"
    ],
    "wcag": [
      "1.3.1 Info and Relationships",
      "4.1.2 Name, Role, Value"
    ],
    "rules": [
      "role=row lives on the host so the flattened tree reads table → rowgroup → row → cell",
      "selected reflects to aria-selected=true and clears when deselected"
    ]
  },
  "figma": { "componentKey": "", "nodeId": "189:2", "codeConnectFile": "table.figma.ts" }
}
