{
  "metaVersion": "1.0.0",
  "status": "beta",
  "name": "rr-radio",
  "summary": "Individual radio button. Must be used inside rr-radio-group, which manages name, value, and selection.",
  "package": "@digital2analogue2/parsimony-components",
  "props": [
    {
      "name": "value",
      "type": "string",
      "default": ""
    },
    {
      "name": "checked",
      "type": "boolean",
      "default": "false"
    },
    {
      "name": "disabled",
      "type": "boolean",
      "default": "false"
    }
  ],
  "slots": [
    {
      "name": "default",
      "description": "Label text."
    }
  ],
  "events": [
    {
      "name": "rr-radio-change",
      "detail": "{ value: string }"
    }
  ],
  "cssParts": [
    {
      "name": "circle",
      "description": "The visual radio circle element."
    },
    {
      "name": "label",
      "description": "The label text element."
    }
  ],
  "tokensUsed": [
    "--color-border-default",
    "--color-background-default",
    "--color-border-hover",
    "--color-background-action",
    "--color-background-disabled",
    "--color-border-disabled",
    "--color-foreground-disabled",
    "--color-border-focus",
    "--color-foreground-alt",
    "--font-label-medium",
    "--spacing-tight",
    "--motion-duration-instant",
    "--motion-easing-default",
    "--motion-easing-enter"
  ],
  "anatomy": {
    "description": "A visual circle beside a label, with the real <input> transparently overlaying the circle. The 16px circle, the 8px dot, and the focus-ring outline are not tokens.",
    "parts": [
      {
        "name": "root",
        "element": ":host",
        "description": "Inline-flex row holding the circle and its label.",
        "tokens": {
          "spacing": "--spacing-tight"
        },
        "parts": [
          {
            "name": "circle",
            "element": ".circle",
            "cssPart": "circle",
            "description": "The visual radio circle. The native input sits transparently on top of it.",
            "tokens": {
              "background": "--color-background-default",
              "border": "--color-border-default",
              "motion": [
                "--motion-duration-instant",
                "--motion-easing-default"
              ]
            },
            "states": [
              {
                "when": "checked",
                "tokens": {
                  "border": "--color-background-action"
                }
              },
              {
                "when": "disabled",
                "tokens": {
                  "background": "--color-background-disabled",
                  "border": "--color-border-disabled"
                }
              },
              {
                "when": [
                  "!disabled",
                  "!checked",
                  ":hover"
                ],
                "description": "Hover only while unchecked and enabled.",
                "tokens": {
                  "border": "--color-border-hover"
                }
              },
              {
                "when": ":focus-visible",
                "description": "Keyboard focus ring on the circle, driven by the hidden input's focus state.",
                "tokens": {
                  "focus": "--color-border-focus"
                }
              }
            ],
            "parts": [
              {
                "name": "dot",
                "element": ".dot",
                "description": "The inner dot, scaled from 0 to 1 when checked.",
                "tokens": {
                  "background": "--color-background-action",
                  "motion": [
                    "--motion-duration-instant",
                    "--motion-easing-enter"
                  ]
                },
                "states": [
                  {
                    "when": "disabled",
                    "tokens": {
                      "background": "--color-foreground-disabled"
                    }
                  }
                ]
              }
            ]
          },
          {
            "name": "label",
            "element": "label",
            "cssPart": "label",
            "description": "The text label beside the circle.",
            "tokens": {
              "foreground": "--color-foreground-alt",
              "font": "--font-label-medium"
            },
            "states": [
              {
                "when": "disabled",
                "tokens": {
                  "foreground": "--color-foreground-disabled"
                }
              }
            ]
          }
        ]
      }
    ]
  },
  "rules": [
    "hard-1",
    "hard-6",
    "hard-9"
  ],
  "guidance": [
    "Always use rr-radio inside an rr-radio-group — selection, name, and form value are managed by the group"
  ],
  "examples": [
    {
      "title": "Default",
      "html": "<rr-radio value=\"sm\">Small</rr-radio>"
    },
    {
      "title": "Checked",
      "html": "<rr-radio value=\"md\" checked>Medium</rr-radio>"
    },
    {
      "title": "Disabled",
      "html": "<rr-radio value=\"lg\" disabled>Large</rr-radio>"
    }
  ],
  "accessibility": {
    "ariaPattern": "https://www.w3.org/WAI/ARIA/apg/patterns/radio/",
    "role": "radio",
    "focusable": true,
    "keyboard": [
      "Space selects the focused radio",
      "Arrow-key navigation and roving focus are handled by the parent rr-radio-group"
    ],
    "wcag": [
      "1.4.3 Contrast (Minimum)",
      "2.1.1 Keyboard",
      "4.1.2 Name, Role, Value"
    ],
    "rules": []
  },
  "figma": {
    "componentKey": "",
    "nodeId": "121:77",
    "codeConnectFile": "radio.figma.ts"
  }
}
