{
  "metaVersion": "1.0.0",
  "status": "beta",
  "name": "rr-menu-item",
  "summary": "A single action inside rr-menu; the host carries role=menuitem and focus is managed by the parent menu.",
  "package": "@digital2analogue2/parsimony-components",
  "props": [
    { "name": "value", "type": "string", "default": "" },
    { "name": "danger", "type": "boolean", "default": false },
    { "name": "disabled", "type": "boolean", "default": false }
  ],
  "slots": [
    { "name": "(default)", "description": "Item label (and optional leading icon)." }
  ],
  "events": [
    { "name": "rr-menu-item-select", "detail": "Bubbles (composed) to rr-menu when the item is activated; detail.value is this item's value. Not fired when disabled." }
  ],
  "cssParts": [
    { "name": "item", "description": "The item row." }
  ],
  "tokensUsed": [
    "--component-menu-item-foreground",
    "--component-menu-item-hover-background",
    "--component-menu-item-danger-foreground",
    "--component-menu-item-danger-hover-background",
    "--component-menu-item-disabled-foreground",
    "--color-border-focus",
    "--font-label-medium",
    "--spacing-tight",
    "--spacing-inline",
    "--radius-sm",
    "--motion-duration-instant",
    "--motion-easing-default"
  ],
  "rules": [
    "Never use hex values. Always use var(--color-*) or var(--component-*)",
    "Never reference --primitive-* tokens in component code",
    "All text/background pairings must pass WCAG AA (4.5:1)",
    "Reserve danger for genuinely destructive actions — one per menu is the norm",
    "Do not rely on color alone for the danger signal — the label must say what is destroyed"
  ],
  "examples": [
    { "title": "Item", "html": "<rr-menu-item value=\"edit\">Edit rule</rr-menu-item>" },
    { "title": "Destructive item", "html": "<rr-menu-item value=\"delete\" danger>Delete rule</rr-menu-item>" },
    { "title": "Disabled item", "html": "<rr-menu-item value=\"export\" disabled>Export (soon)</rr-menu-item>" }
  ],
  "accessibility": {
    "ariaPattern": "https://www.w3.org/WAI/ARIA/apg/patterns/menu-button/",
    "role": "menuitem",
    "focusable": true,
    "keyboard": [
      "Enter or Space activates the item",
      "Focus arrives via the parent menu's roving keyboard navigation"
    ],
    "wcag": [
      "1.4.3 Contrast (Minimum)",
      "2.1.1 Keyboard",
      "4.1.2 Name, Role, Value"
    ],
    "rules": [
      "role=menuitem and tabindex=-1 live on the host so the flattened tree reads menu → menuitem",
      "Disabled items expose aria-disabled=true and stay visible — hidden options are undiscoverable options"
    ]
  },
  "figma": { "componentKey": "9f299a57d0007a7b0414efe72d32eb352c1efd57", "nodeId": "186:2", "codeConnectFile": "menu.figma.ts" }
}
