{
  "metaVersion": "1.0.0",
  "status": "stable",
  "name": "rr-input",
  "summary": "Form-associated text input with label, helper/error text, and ElementInternals for native form participation.",
  "package": "@digital2analogue2/parsimony-components",
  "props": [
    {
      "name": "type",
      "type": "string",
      "default": "text"
    },
    {
      "name": "name",
      "type": "string",
      "default": ""
    },
    {
      "name": "value",
      "type": "string",
      "default": ""
    },
    {
      "name": "placeholder",
      "type": "string",
      "default": ""
    },
    {
      "name": "label",
      "type": "string",
      "default": ""
    },
    {
      "name": "helper-text",
      "type": "string",
      "default": ""
    },
    {
      "name": "error-text",
      "type": "string",
      "default": ""
    },
    {
      "name": "required",
      "type": "boolean",
      "default": false
    },
    {
      "name": "disabled",
      "type": "boolean",
      "default": false,
      "bindings": {
        "code": {
          "prop": "disabled"
        },
        "figma": {
          "kind": "VARIANT",
          "property": "State",
          "valueMap": {
            "disabled": true
          }
        }
      }
    },
    {
      "name": "autocomplete",
      "type": "string",
      "default": ""
    }
  ],
  "slots": [
    {
      "name": "label",
      "description": "Optional override for the label content."
    }
  ],
  "events": [
    {
      "name": "input",
      "detail": "Fired on each keystroke, mirrors native input event."
    },
    {
      "name": "change",
      "detail": "Fired on value commit (blur), mirrors native change event."
    }
  ],
  "cssParts": [
    {
      "name": "label",
      "description": "The label element above the input."
    },
    {
      "name": "input",
      "description": "The inner <input> element."
    },
    {
      "name": "helper",
      "description": "The helper text container."
    },
    {
      "name": "error",
      "description": "The error message container."
    }
  ],
  "tokensUsed": [
    "--color-background-default",
    "--color-background-alt",
    "--color-foreground-default",
    "--color-foreground-muted",
    "--color-foreground-alt",
    "--color-foreground-danger",
    "--color-foreground-disabled",
    "--color-border-default",
    "--color-border-hover",
    "--color-border-focus",
    "--color-border-disabled",
    "--radius-sm",
    "--spacing-element",
    "--spacing-tight",
    "--font-label-medium",
    "--font-body-large",
    "--font-label-small"
  ],
  "anatomy": {
    "description": "Four siblings under a layout-only host. The label/helper/error margins in input.ts are hardcoded px, not spacing tokens — they are deliberately not transcribed as bindings.",
    "parts": [
      {
        "name": "root",
        "element": ":host",
        "description": "Host wrapper. Layout only (display: block) — carries no tokens.",
        "parts": [
          {
            "name": "label",
            "element": "label",
            "cssPart": "label",
            "description": "Field label above the input.",
            "tokens": {
              "foreground": "--color-foreground-alt",
              "font": "--font-label-medium"
            },
            "states": [
              {
                "when": "disabled",
                "tokens": {
                  "foreground": "--color-foreground-disabled"
                }
              }
            ],
            "parts": [
              {
                "name": "required-marker",
                "element": ".required",
                "description": "The asterisk appended to a required field's label (aria-hidden).",
                "tokens": {
                  "foreground": "--color-foreground-danger"
                }
              }
            ]
          },
          {
            "name": "input",
            "element": "input",
            "cssPart": "input",
            "description": "The native <input>: field surface, text colour, and outline.",
            "tokens": {
              "background": "--color-background-default",
              "foreground": "--color-foreground-default",
              "border": "--color-border-default",
              "spacing": [
                "--spacing-tight",
                "--spacing-element"
              ],
              "font": "--font-body-large",
              "radius": "--radius-sm"
            },
            "states": [
              {
                "when": ":hover",
                "tokens": {
                  "border": "--color-border-hover"
                }
              },
              {
                "when": ":focus",
                "tokens": {
                  "focus": "--color-border-focus"
                }
              },
              {
                "when": "data-invalid",
                "description": "Set internally while error-text is non-empty.",
                "tokens": {
                  "border": "--color-foreground-danger"
                }
              },
              {
                "when": "disabled",
                "tokens": {
                  "background": "--color-background-alt",
                  "foreground": "--color-foreground-disabled",
                  "border": "--color-border-disabled"
                }
              },
              {
                "when": [
                  "data-invalid",
                  ":focus"
                ],
                "description": "Focus ring while invalid — the ring turns danger red.",
                "tokens": {
                  "focus": "--color-foreground-danger"
                }
              }
            ],
            "parts": [
              {
                "name": "placeholder",
                "element": "::placeholder",
                "description": "Placeholder text inside the field.",
                "tokens": {
                  "foreground": "--color-foreground-muted"
                }
              }
            ]
          },
          {
            "name": "helper",
            "element": ".helper",
            "cssPart": "helper",
            "description": "Helper text below the field. Replaced by the error part while invalid.",
            "tokens": {
              "foreground": "--color-foreground-muted",
              "font": "--font-label-small"
            }
          },
          {
            "name": "error",
            "element": ".error",
            "cssPart": "error",
            "description": "Error message below the field (role=alert).",
            "tokens": {
              "foreground": "--color-foreground-danger",
              "font": "--font-label-small"
            }
          }
        ]
      }
    ]
  },
  "rules": [
    "hard-1",
    "hard-6",
    "hard-9"
  ],
  "examples": [
    {
      "title": "Default",
      "html": "<rr-input label=\"Email\" placeholder=\"you@example.com\"></rr-input>"
    },
    {
      "title": "With helper text",
      "html": "<rr-input label=\"Username\" helper-text=\"Must be 3-20 characters\"></rr-input>"
    },
    {
      "title": "Error state",
      "html": "<rr-input label=\"Email\" value=\"bad\" error-text=\"Invalid email address\"></rr-input>"
    },
    {
      "title": "Required",
      "html": "<rr-input label=\"Name\" required></rr-input>"
    },
    {
      "title": "Disabled",
      "html": "<rr-input label=\"Locked\" value=\"Cannot edit\" disabled></rr-input>"
    },
    {
      "title": "With autocomplete",
      "html": "<rr-input label=\"Email\" type=\"email\" autocomplete=\"email\"></rr-input>"
    }
  ],
  "accessibility": {
    "ariaPattern": "https://www.w3.org/WAI/ARIA/apg/patterns/textbox/",
    "focusable": true,
    "keyboard": [
      "Tab moves focus to the input",
      "Standard text editing keys work natively"
    ],
    "wcag": [
      "1.3.1 Info and Relationships",
      "1.3.5 Identify Input Purpose",
      "1.4.3 Contrast (Minimum)",
      "2.4.6 Headings and Labels",
      "3.3.1 Error Identification",
      "3.3.2 Labels or Instructions"
    ],
    "rules": [
      "aria-errormessage points to error div; aria-describedby mirrors the link while invalid as AT fallback.",
      "When valid, aria-describedby points to helper text. When invalid, it switches to error text.",
      "delegatesFocus ensures host element forwards focus to inner <input>.",
      "ElementInternals.setFormValue() keeps the form value in sync with the input."
    ]
  },
  "figma": {
    "componentKey": "",
    "nodeId": "103:27",
    "codeConnectFile": "input.figma.ts",
    "ignoredOptions": {
      "State": [
        "default",
        "hover",
        "focus",
        "error"
      ]
    }
  }
}
